,album_info,album_title,lyrics,song_title
78,"album: ""Younger Now"" (2017)","""Younger Now""","

I never came to the beach or stood by the ocean
I never sat by the shore under the sun with my feet in the sand
But you brought me here and I'm happy that you did
'Cause now I'm as free as birds catching the wind

I always thought I would sink, so I never swam
I never went boatin', don't get how they are floatin'
And sometimes I get so scared
Of what I can't understand

But here I am
Next to you
The sky's more blue
In Malibu
Next to you
In Malibu
Next to you, baby

We watched the sun go down as we were walking
I'd spend the rest of my life just standing here talking
You would explain the current as I just smile
Hoping that you'll stay the same and nothing will change
And it'll be us just for a while
Do they even exist?
That's when I make the wish
To swim away with the fish

Is it supposed to be this hot all summer long?
I never would've believed you
If three years ago you told me
I'd be here writing this song

But here I am
Next to you
The sky's so blue
In Malibu
Next to you
In Malibu
Next to you, baby

Next to you
The sky's so blue
In Malibu, baby
Next to you

We are just like the waves that flow back and forth
Sometimes I feel like I'm drowning and you're there to save me
And I wanna thank you with all of my heart
It's a brand new start
A dream come true
In Malibu
",Malibu
79,"album: ""Younger Now"" (2017)","""Younger Now""","

[Dolly Parton:]
Hey, Miley
It's me, I'm in Nashville
I'm on my way to Dollywood, busy as you are
Can't get enough stuff to do, can't
But anyway, I'm excited about singing with you
So I'm just gonna turn my CD player on with you singing
I'm gon' put this on a cassette
Sing along with it, and then I'll run you off a CD later
Oh, I'm so high tech
I got a flip phone too
But anyhow, see what you think
And mmm, here I go
Come on

[Miley Cyrus & Dolly Parton:]
Livin' in a rainbowland
Where everything goes as planned and I smile
'Cause I know if we tried, we could really make a difference in this world
I won't give up or sleep a wink
It's the only thought I think
You know where I stand
I believe we can start livin' in a rainbowland

Livin' in a rainbowland
Where you and I go hand in hand
Oh, I'd be lyin' (I'd be lyin'), if I said this was fine
All the hurt and the hate going on here (hate going on here)
We are rainbows, me and you
Every color, every hue
Let's shine through
Together we can start livin' in a rainbowland

Living in a rainbowland
Where skies are blue and things are grand
Oh, wouldn't it be nice to live in paradise
Where we're free to be exactly who we are
Let's all dig down deep inside
Brush the judgement and fear aside
Make wrong things right (all things right), and end the fight
'Cause I promise ain't nobody gonna win
(C'mon)

Livin' in a rainbowland
Where you and I go hand in hand
Oh, I'd be lyin' (I'd be lyin'), if I said this was fine
All the hurt and the hate going on here (hate going on here)
We are rainbows, me and you
Every color, every hue
Let's shine through
Together we can start livin' in a rainbowland

Livin' in a rainbowland
Where you and I go hand in hand together (let's do it together)
Change things forever (forever)
I know there's got to be a greener plan
We are rainbows, me and you
Every color, every hue
Let's shine through (shine my head)
Together we can start livin' in a rainbowland

[Dolly Parton:]
Hey, Miley
Look, I know it sounds scrambled when I'm singing it with you
But [?] do a little bit better
At least, I may not get it all the way through
'Cause I'm not sure of the structure without you
But I think this could work well, don't you?
If not, like I said
I'll write that love song for you
You probably wrote it about some boy you loved, didn't you?
Well...
",Rainbowland
80,"album: ""Younger Now"" (2017)","""Younger Now""","

If I spent a week without you
Bet you'd wonder what I do
I think that I'd start going out
Get caught kissing other dudes

And it seems you just wanna bring me down, down
With your bad attitude (bad attitude)
When you know I'm not one to keep dealing with the shit
That you put me through

I know that I gave you my heart
But you stomped it to the ground
And that's what got me wondering what it's like
To not have you around

If I spent a week without you
Hmm, I'd probably have so much fun
First thing first I'd gather up all my girls, yeah
So we can lay out in the sun

It would be so nice not to worry, yeah
How I love not to stress
I'd go and grab my old blue jeans
I'm sick of wearing this silly dress

I know that I gave you my heart
But you stomped it to the ground
And that's what got me wondering what it's like
To not have you around

You know I'd miss you, baby
Feels like I've known you since I was just 7 years old
You used to make me smile but now you don't do that anymore
It feels like I'm always just crying and sleeping alone
But when I think of you gone, I know

I know that I gave you my heart
But you stomped it to the ground
I don't want to wonder what it's like
To not have you around

To not have you around
To not have you around
To not have you around
To not have you around

You know I'd miss you, baby
You know I’d miss you, baby
You know I'd miss you, baby
(Know I'd miss you)
",Week Without You
81,"album: ""Younger Now"" (2017)","""Younger Now""","

They say love can drive ya crazy, my dear
I wanna trap you in a locket, or in my pocket
So I can keep you near
You know I'd never hurt you
If you fall, I'd pick you up and I'd drink your tears
But how can I miss you so much when you're right here?

They say good things come to those who wait
It's like countin' in light years
I'd physically live without you, but I don't want to
And death's never been my fear
You can take my blood, take my bones
My heart is yours, I volunteer
But how can I miss you so much when you're right here?

When you look up at a rainbow
Do you ever wonder what's really waiting at the end?
I don't want no gold, nothing's more than you
The amount is hard to even comprehend
Nothing I can do, I lost control
Something we hold on to so dear
But how can I miss you so much when you're right here?

And how at this optimal time did you just appear?
Everyone under their guard is so full of shit
But you are just so sheer
You're my God, you're my faith
On my knees, I look at you and I revere
But how can I miss you so much when you're right here?

When you look up at the cosmos
Do you ever wonder if there's really even an end?
It might go on forever, like my love for you
An amount that's hard to even comprehend
I won't waste my time with wonder, in apprehension, or livin' life in fear
But how can I miss you so much when you're right here?

You're my God, you're my faith
On my knees, I look at you and I revere
You can take my blood, take my bones
My heart is yours, I volunteer
But how can I miss you so much when you're right here?
But how can I miss you so much when you're right here?
",Miss You So Much
82,"album: ""Younger Now"" (2017)","""Younger Now""","

You are everything to me
And I, I would die for you
There've been times when I'm up all night
Crying in the dark, so I sleep with the light on
I've heard I've got words like a knife
That I don't always choose just so wisely
But I see trees and the colored leaves
When I think about all that we could be

And when you're gone, time moves so slow
And like the grass, I've watched us grow
I heard you reap only what you'll sow
How could I never let you know?

But you are everything to me
You're sweeter than candy cane, better than any childhood dream
I am yours, and you are mine
I have your heart, I don't even need your ring
I'd give up all I have in exchange for who I love more than anything

When you're gone, time moves so slow
Like the grass, I've watched us grow
I've heard you reap only what you'll sow
How could I ever let you go?

You, you are everything to me
And I, I would die for you
Yeah, I would die for you

When you're gone, time moves so slow (I would die)
Like the grass, I've watched us grow (I would die)
I've heard you reap only what you'll sow (I would die)
How could I never let you know? (I would die for you)
",I Would Die For You
83,"album: ""Younger Now"" (2017)","""Younger Now""","

One, two, three, four

I don't know where you always go
Why you trying to keep it on the low?
I'm always like, ""Where the hell you've been?""
You tell me that you've been hanging with your friends
Something seems just a little suss
We ain't got nothing, if there ain't no trust
I'm not sure, but I got a hunch
And now you've got me thinkin' way too much

I've been thinkin' way too much, much, much, much
You ain't been callin' me enough, 'nough, 'nough, 'nough
Now I'm longing for your touch, touch, touch, touch
I've been thinkin' way too much
I've been thinkin' way too much
You won't pick up the phone, phone, phone, phone
Now I'm sitting here alone, lone, lone, lone
Do you do this just for fun, fun, fun, fun
I've been thinkin' way too much
I've been thinkin' way too much

Oh yeah, all I do is think about you
Oh yeah, all I do is think about you
Oh yeah, all I do is think about you
Oh yeah, all I do is think about you

It's getting late, I'm starting to obsess
You got me cryin' and lookin' like a mess
My daddy said, ""Stay away from such""
But now you got me thinkin' way too much

I've been thinkin' way too much, much, much, much
You ain't been callin' me enough, 'nough, 'nough, 'nough
Now I'm longing for your touch, touch, touch, touch
I've been thinkin' way too much
I've been thinkin' way too much
You won't pick up the phone, phone, phone, phone
Now I'm sitting here alone, lone, lone, lone
Do you do this just for fun, fun, fun, fun
I've been thinkin' way too much
I've been thinkin' way too much

Oh yeah, all I do is think about you
Oh yeah, all I do is think about you
Oh yeah, all I do is think about you
Oh yeah, all I do is think about you

All night, all I do is think about you
All night, all I do is think about you
All night, all I do is think about you
All night, all I do is think about you

All night, all I do is think about you
All night, all I do is think about you
All night, all I do is think about you
All night, all I do is think about you

I've been thinkin' way too much, much, much, much
You ain't been callin' me enough, 'nough, 'nough, 'nough
Now I'm longing for your touch, touch, touch, touch
I've been thinkin' way too much
I've been thinkin' way too much
You won't pick up the phone, phone, phone, phone
Now I'm sitting here alone, lone, lone, lone
Do you do this just for fun, fun, fun, fun
I've been thinkin' way too much
I've been thinkin' way too much

Oh yeah, all I do is think about you
Oh yeah, all I do is think about you
Oh yeah, all I do is think about you
Oh yeah, all I do is think about you
",Thinkin'
84,"album: ""Younger Now"" (2017)","""Younger Now""","

Oooh, I wake up in a bad mood
Oooh, I wake up in a bad mood

I always wake up in a bad mood
I can never fall asleep
I'm always thinkin' 'bout you
What life would be if we didn't meet
I always wake up in a bad mood
Open my eyes and I'm on my feet
And I wonder what you would do, yeah
If you couldn't rely on me

Oooh, I wake up in a bad mood
Oooh, I wake up in a bad mood
And you know that I got the proof
We're held together just by a string
And while you're hanging around with your crew
I'm a balance in too many things

I always wake up in a bad mood
I'm sick of rushing straight to the sink
You acting like you ain't got the news
I don't even really care what you think
But what I do you know I do with love
I believe in more than you can see
And you know I'm never giving up
I ain't stopping till I know I'm free

Oooh, I wake up in a bad mood
Oooh, I wake up in a bad mood
The glass ceiling's about to break
All together, want to hear you say
""I don't know how much more I can take""

You know it's gone on way too long (don't ya?)
And you know it's wrong (don't ya?)
But I know I'm strong (yes, sir)
I don't give up (no, sir)
And when it gets rough (rough)
I get tough (tough)
I've had enough

Oooh, I wake up in a bad mood
Oooh, I wake up in a bad mood
And when the light starts getting dim
I'll open windows up and let it in
Sometimes it feels like it's about to end
Before it's all about to begin

Oooh, I wake up in a bad mood
Oooh, I wake up in a bad mood
",Bad Mood
85,"album: ""Younger Now"" (2017)","""Younger Now""","

(You gotta love someone)

I don't know what you've been told
Or what they say about me
I never give up, but give it a rest
I ain't got time to worry about a mess
And I'm kinda getting tired of dealing with all your stress
I'm starting to think you have no heart
You don't even have a soul
You always give in or you try too late
All I do is give and all you do is take
I'm tired of protecting you from what you need to know, come on

Ever since the day that I met you
I knew you weren't the one
But nothing ever stops me from forgetting
Packing all my shit and moving on

I'm not sure where I'd even go
Cause I made your house my home
It's come to an end, I hate how it's been
Lights are getting dim and the walls are caving in
And it's time for this queen to go and find another throne
When I give it up, I give it all
I went and made you my life
Don't you dare say I don't care
When I need you most you know you're never there
It'd be a cold day in hell before I'd ever be your wife, that's right

Ever since the day that I met you
I knew you weren't the one
But nothing ever stops me from forgetting
Packing all my shit and moving on

Kicking off my shoes and running towards the sun
I said ""Nothing's really worth it unless you're having fun""
To make somebody stay
You gotta love someone
You gotta love someone

Ever since the day that I met you
I knew you weren't the one
But nothing ever stops me from forgetting
Packing all my shit and moving on

You gotta love someone
You gotta love someone
You gotta love someone
You gotta love someone
",Love Someone
86,"album: ""Younger Now"" (2017)","""Younger Now""","

I want to start by saying thank you
I'm gonna miss you, honey
You gave me things, you can't buy back with money
You changed my life
You've been my world
There's no other girl that looks like you, darling
Those eyes, that tongue, those teeth, that face, that body
Even though we've gone to outer space
Still no way you can take his place

You're not him
She's not him
No matter what you say
No matter what you do
I just can't fall in love with you
Cause you're not him
Yeah, she's not him

And why, why can't I love you, baby?
Like I wanna love you, baby
I'm sorry
And maybe it's beyond my control
Some sort of chemical reaction
Making it impossible to let him go

You're not him
She's not him
No matter what you say
No matter what you do
I just can't fall in love with you
Cause you're not him
Yeah, she's not him

And you don't deserve all the bullshit I've put you through
You, you deserve a heart much bigger than one that's torn in two

You're not him
She's not him
Every time you walk through my door
I swear to God you're more beautiful than before, but you're not him
No matter what you say
No matter what you do
I just can't fall in love with you
But you're not him
Yeah, she's not him
",She's Not Him
87,"album: ""Younger Now"" (2017)","""Younger Now""","

I'm writing down my dreams,
All I'd like to see
Starting with the bees,
Or else they're gonna die

There won't be no trees,
Or air for us to breathe
I'll start feeling mad,
But then I feel inspired

Thinking about the days
Coming home with dirty feet
From playing with my dad
All day in the creek

He somehow has a way
Of knowing what to say
So when I'm feeling sad,
He makes me feel inspired

We are meant for more
You're the handle on the door
That opens up to change
I know that sounds so strange
To think we are meant for more
You're the handle on the door
That opens up to change
I know that sounds so strange
'Cause you've always felt so small
But no, you aren't at all
And I hope you feel inspired
Oh, I hope you feel inspired

And how can we escape
All the fear and all the hate?
Is anyone watching us down here?

Death is life, it's not a curse
Reminds us of time and what it's worth
To make the most of it while we're here

We are meant for more
You're the handle on the door
That opens up to change
I know it sounds so strange
To think we are meant for more
There's a lock upon the door
But we hold the key to change

But how can we escape
All the fear and all the hate?
Is anyone watching us down here?
",Inspired
88,"EP: ""SHE IS COMING"" (2019)","""SHE IS COMING""","

Hallelujah, I'm a freak, I'm a freak
Hallelujah, every day of the week
I'mma do yeah, like I want ah
I'mma Nile crocodile, a piranha

Oh my God, she got the power
Oh look at her, she got the power

Don't fuck with my freedom
I came up to get me some
I'm nasty, I'm evil
Must be something in the water
Or that I'm my mother's daughter
Don't fuck with my freedom
I came up to get me some
I'm nasty, I'm evil
Must be something in the water
Or that I'm my mother's daughter

So back up, back up, back up, back up, boy, ooh
Back up, back up, back up, back up, boy, ooh hey

Hallelujah, I'mma witch, I'mma witch
Hallelujah, swish, swish
I'mma three point shooter
I blow through ya
Like a hot wind out in the bayou, yeah

Oh my God, she got the power
Whoa look at her, she got the power

Don't fuck with my freedom
I came up to get me some
I'm nasty, I'm evil
Must be something in the water
Or that I'm my mother's daughter
Don't fuck with my freedom
I came up to get me some
I'm nasty, I'm evil
Must be something in the water
Or that I'm my mother's daughter

So back up, back up, back up, back up, boy, ooh
Back up, back up, back up, back up, boy, ooh
Back up, back up, back up, back up, boy, ooh
Back up, back up, back up, back up, boy, ooh

My mama always told me that I'd make it
That I'd make it, so I made it
I put my back into it, my heart in it
So I did it, yeah I did it
My mama always told me that I'd make it
That I'd make it, so I made it
I put my back into it, my heart in it
So I did it, yeah I did it

Don't fuck with my freedom
I came up to get me some
I'm nasty, I'm evil
Must be something in the water
Or that I'm my mother's daughter
Don't fuck with my freedom
Oh my God, oh my God
Don't fuck with my freedom
Oh my God, oh my God
Don't fuck with my freedom
Oh my God, oh my God
Don't fuck with my freedom
Oh my God, oh my God

Swish swish, motherfucker
",Mother's Daughter
89,"EP: ""SHE IS COMING"" (2019)","""SHE IS COMING""","

I'm a little drunk, I know it
I'ma get high as hell
I'm a little bit unholy
So what? So is everyone else
I'm a little drunk, I know it
I'ma get high as hell
I'm a little bit unholy
So what? So is everyone else

Wake up in the middle of a breakdown (Yeah)
Have sex on the table with the take out
I'm sick of the fakin', the usin', the takin'
The people callin' me obscene
You hate me, you love me, you just wanna touch me
I'm only tryna get some peace
So let me do me

I'm a little drunk, I know it
I'ma get high as hell
I'm a little bit unholy
So what? So is everyone else
I'm a little drunk, I know it
I'ma get high as hell
I'm a little bit unholy
So what? So is everyone else
So what? So is everyone else
So what? So is everyone else

I'm a little drunk, I know it
I'ma get high as hell
I'm a little bit unholy
So what? So is everyone else
So what? So is everyone else
So what? So is everyone else

Yeah
",Unholy
90,"EP: ""SHE IS COMING"" (2019)","""SHE IS COMING""","

[Miley Cyrus:]
You're in my bed uninvited
It's fine, 'cause I'm in the mood
Hope you don't mind if I spike it
We'll drink it, just me and you

And you know we're gonna be alright
We'll be sleeping on the red eye flight
Keep up with me 'til the end of the night
And we're just getting started

Always last to leave the party
Drugs rule everything around me
Wake up with new tattoos on my body
Drugs rule everything around me

Get the Ghost, raise a toast, pop the Molly
I can go toe-to-toe like I'm Ali
We're all tryna fill the lonely
Drugs rule everything around me
Drugs rule everything around me
Drugs rule everything around me

These planes are all UFOs and
This city's in outer space
It's better than where we came from
I think that we both should stay

'Cause you know we're gonna be alright
We'll be fucking on the red eye flight
Keep up with me 'til the end of the night
And we're just getting started

Always last to leave the party
Drugs rule everything around me
Wake up with new tattoos on my body
Drugs rule everything around me

Get the Ghost, raise a toast, pop the Molly
All the girls in my room look like Dolly
We're all tryna fill the lonely
Drugs rule everything around me
(Drugs rule everything around me)
Drugs rule everything around me
Drugs rule everything around me
Drugs rule everything around me
Drugs rule everything around me

[Ghostface Killah:]
Drugs rule everything around me
You can call me a king
I got it all in my store
You should crown me
Purple, Percs, sticky green, Molly
Sippy lean
Got the white that's sure to light the floor like in Billie Jean
Scarface nights (nights)
Five hundred thousand on the pinky
Broadway ice
Ice, we throw diamonds at weddings
And y'all throw rice (rice)
Lollapalooza, Coachella custies, that's my type
Party all night
",D.R.E.A.M. (Drugs Ruled Everything Around Me)
91,"EP: ""SHE IS COMING"" (2019)","""SHE IS COMING""","

Miley Cyrus
Bitch you look like you done already did had yours
You better go take your country ass indoors and put some damn clothes on
'Cause nobody need to be seeing all of that
The library is officially open

This cat is in heat
Lemme ride that beat
My pussy on fire
Pussy five-alarm fire

This cat is in heat
Lemme ride that beat
My pussy on fire
Pussy five-alarm fire

Turn up your gratitude
Turn on your attitude
I love my pussy that means I got cattitude
If you don't feel what I'm sayin'
(I don't fuck with you)
If you don't feel what I'm sayin'
(I don't fuck with you)

Turn up you gratitude
Turn down your attitude
I love my pussy that means I got cattitude
If you don't feel what I'm sayin'
(I don't fuck with you)
If you don't feel what I'm sayin'
(I don't fuck with you)

Ay, go stupid, go dumb
Come and get it, 'cause I know you want some
Nashville, Tennessee where I'm from
Since I was three, I been bangin' on the drum
Rum-pum-pum-pum a-rum-pum-pum-pum-pum
Rum-pum-pum-pum a-rum-pum-pum-pum-pum
Rum-pum-pum-pum a-rum-pum-pum-pum-pum
Rum-pum-pum-pum pum-pum-pum-pum-pum-nasty

I'm so nasty
Nasty
Nasty
I'm so motherfuckin' nasty

Rise, shine, clock say ""pussy time""
Bust my pussy nut while I'm fingerin' your butt
Do I suck dick? You ain't seen shit
Throw a C-note, watch it slide down my throat
Yeah, my pussy fine, I pop it 'cause it's mine
I don't give a fuck if they call me a slut
What I do with a dick, elect me Presidick
Put tears in his eyes when I milk a brother dry

So nasty
Nasty
Nasty
Nasty
Nasty

I'ma keep workin' from dawn to dusk
So I can keep buyin' cars off Elon Musk
The matte-black spinners, no that's a must
I want the whole pie, so leave the crust
I'm the moon, I'm the stars, I'm a Maserati
I love you, Nicki, but I listen to Cardi
I got a new song on the radio
And it goes five, four, three, two
One, that's right, it's a number one
And I can't take you with me as a carry-on
I already got my luggage, it's Margielan
And for my sixteenth birthday, I got Carey on
From the house of the queen

Queen, ""Queen"" is what you can call me
Queen, I'ma have you runnin' to your mommy
Queen, I'm the life of the party
Don't worry 'bout me, go and get yourself a hobby

(Sweet pussy of mine)
I'm so nasty
(Sweet pussy of mine)

Turn up your gratitude
Turn down your attitude
I love my pussy that means I got cattitude
If you don't feel what I'm sayin'
I don't fuck with you
If you don't feel what I'm sayin'
I don't fuck with you

(Get it, get it)
I'm so nasty
(Cash money)
I'm so nasty
(Get it, get it)
(Got it good)

Turn up your gratitude
Turn down your attitude
I love my pussy that means I got cattitude
If you don't feel what I'm sayin'
I don't fuck with you
If you don't feel what I'm sayin'
I don't fuck with you

Back up, you're squashin' my charisma
Why I gotta be so motherfuckin' extra?
Back up, you're squashin' my charisma
Why I gotta be so motherfuckin' extra?

(Get it, get it)
I'm so nasty
(Cash money)
Nasty
(Get it, get it)
I'm so nasty
(Cash money)
I'm so motherfuckin' nasty

You're just mad 'cause your hair is flat
I'm so motherfuckin' nasty
You're just mad 'cause your hair is flat
I'm so motherfuckin' nasty
",Cattitude
